[
  {
    "file": "images/web_001.jpeg",
    "title": "光の粒子",
    "series": "landscape",
    "tags": [
      "精选"
    ]
  },
  {
    "file": "images/web_002.jpeg",
    "title": "午後の静寂",
    "series": "landscape",
    "tags": [
      "精选"
    ]
  },
  {
    "file": "images/web_003.jpeg",
    "title": "街の断片",
    "series": "landscape",
    "tags": [
      "精选"
    ]
  },
  {
    "file": "images/web_004.jpeg",
    "title": "俯瞰",
    "series": "landscape",
    "tags": [
      "精选"
    ]
  },
  {
    "file": "images/web_005.jpeg",
    "title": "風の軌跡",
    "series": "landscape",
    "tags": [
      "精选"
    ]
  },
  {
    "file": "images/web_006.jpeg",
    "title": "視線の先",
    "series": "landscape",
    "tags": [
      "精选"
    ]
  },
  {
    "file": "images/web_007.jpeg",
    "title": "都市の影",
    "series": "landscape",
    "tags": [
      "精选"
    ]
  },
  {
    "file": "images/web_008.jpeg",
    "title": "沈黙の肖像",
    "series": "landscape",
    "tags": [
      "精选"
    ]
  },
  {
    "file": "images/web_009.jpeg",
    "title": "路地裏",
    "series": "landscape",
    "tags": [
      "精选"
    ]
  },
  {
    "file": "images/web_010.jpeg",
    "title": "空からの視点",
    "series": "landscape",
    "tags": [
      "精选"
    ]
  },
  {
    "file": "images/web_011.jpeg",
    "title": "夜の輪郭",
    "series": "landscape",
    "tags": [
      "精选"
    ]
  },
  {
    "file": "images/web_012.jpeg",
    "title": "朝の気配",
    "series": "landscape",
    "tags": [
      "精选"
    ]
  },
  {
    "file": "images/web_013.jpeg",
    "title": "水鏡",
    "series": "landscape",
    "tags": [
      "精选"
    ]
  },
  {
    "file": "images/web_014.jpeg",
    "title": "故郷の風景",
    "series": "landscape",
    "tags": [
      "精选"
    ]
  },
  {
    "file": "images/web_015.jpeg",
    "title": "都市の脈絡",
    "series": "landscape",
    "tags": [
      "精选"
    ]
  },
  {
    "file": "images/web_016.jpeg",
    "title": "時の層",
    "series": "landscape",
    "tags": [
      "精选"
    ]
  },
  {
    "file": "images/web_017.jpeg",
    "title": "空と大地",
    "series": "landscape",
    "tags": [
      "精选"
    ]
  },
  {
    "file": "images/web_018.jpeg",
    "title": "街角の光",
    "series": "landscape",
    "tags": [
      "精选"
    ]
  },
  {
    "file": "images/web_019.jpeg",
    "title": "無言の対話",
    "series": "landscape",
    "tags": [
      "精选"
    ]
  },
  {
    "file": "images/web_020.jpeg",
    "title": "雲の上",
    "series": "landscape",
    "tags": [
      "精选"
    ]
  },
  {
    "file": "images/web_021.jpeg",
    "title": "暮色",
    "series": "landscape",
    "tags": [
      "精选"
    ]
  },
  {
    "file": "images/web_022.jpeg",
    "title": "一瞬の表情",
    "series": "landscape",
    "tags": [
      "精选"
    ]
  },
  {
    "file": "images/web_023.jpeg",
    "title": "東京の隙間",
    "series": "landscape",
    "tags": [
      "精选"
    ]
  },
  {
    "file": "images/web_024.jpeg",
    "title": "遠くの灯",
    "series": "landscape",
    "tags": [
      "精选"
    ]
  },
  {
    "file": "images/web_025.jpeg",
    "title": "静寂の朝",
    "series": "landscape",
    "tags": [
      "精选"
    ]
  },
  {
    "file": "images/web_026.jpeg",
    "title": "交差点",
    "series": "landscape",
    "tags": [
      "精选"
    ]
  },
  {
    "file": "images/web_027.jpeg",
    "title": "鳥瞰",
    "series": "landscape",
    "tags": [
      "精选"
    ]
  },
  {
    "file": "images/web_028.jpeg",
    "title": "光と影",
    "series": "landscape",
    "tags": [
      "精选"
    ]
  },
  {
    "file": "images/web_029.jpeg",
    "title": "風の通り道",
    "series": "landscape",
    "tags": [
      "精选"
    ]
  },
  {
    "file": "images/web_030.jpeg",
    "title": "記憶の隅",
    "series": "landscape",
    "tags": [
      "精选"
    ]
  },
  {
    "file": "images/web_031.jpeg",
    "title": "余白",
    "series": "landscape",
    "tags": [
      "备用"
    ]
  },
  {
    "file": "images/web_032.jpeg",
    "title": "光跡",
    "series": "landscape",
    "tags": [
      "备用"
    ]
  },
  {
    "file": "images/web_033.jpeg",
    "title": "隙間",
    "series": "landscape",
    "tags": [
      "备用"
    ]
  },
  {
    "file": "images/web_034.jpeg",
    "title": "行方",
    "series": "landscape",
    "tags": [
      "备用"
    ]
  },
  {
    "file": "images/web_035.jpeg",
    "title": "残像",
    "series": "landscape",
    "tags": [
      "备用"
    ]
  },
  {
    "file": "images/web_036.jpeg",
    "title": "層",
    "series": "landscape",
    "tags": [
      "备用"
    ]
  },
  {
    "file": "images/web_037.jpeg",
    "title": "輪郭",
    "series": "landscape",
    "tags": [
      "备用"
    ]
  },
  {
    "file": "images/web_038.jpeg",
    "title": "対話",
    "series": "landscape",
    "tags": [
      "备用"
    ]
  },
  {
    "file": "images/web_039.jpeg",
    "title": "温度",
    "series": "landscape",
    "tags": [
      "备用"
    ]
  },
  {
    "file": "images/web_040.jpeg",
    "title": "気配",
    "series": "landscape",
    "tags": [
      "备用"
    ]
  },
  {
    "file": "images/web_041.jpeg",
    "title": "遠景",
    "series": "landscape",
    "tags": [
      "备用"
    ]
  },
  {
    "file": "images/web_042.jpeg",
    "title": "静物",
    "series": "landscape",
    "tags": [
      "备用"
    ]
  },
  {
    "file": "images/web_043.jpeg",
    "title": "交差",
    "series": "landscape",
    "tags": [
      "备用"
    ]
  },
  {
    "file": "images/web_044.jpeg",
    "title": "片隅",
    "series": "landscape",
    "tags": [
      "备用"
    ]
  },
  {
    "file": "images/web_045.jpeg",
    "title": "明暗",
    "series": "landscape",
    "tags": [
      "备用"
    ]
  },
  {
    "file": "images/web_046.jpeg",
    "title": "通り雨",
    "series": "landscape",
    "tags": [
      "备用"
    ]
  },
  {
    "file": "images/web_047.jpeg",
    "title": "陽だまり",
    "series": "landscape",
    "tags": [
      "备用"
    ]
  },
  {
    "file": "images/web_048.jpeg",
    "title": "影絵",
    "series": "landscape",
    "tags": [
      "备用"
    ]
  },
  {
    "file": "images/web_049.jpeg",
    "title": "遊歩",
    "series": "landscape",
    "tags": [
      "备用"
    ]
  },
  {
    "file": "images/web_050.jpeg",
    "title": "浮遊",
    "series": "landscape",
    "tags": [
      "备用"
    ]
  },
  {
    "file": "images/web_051.jpeg",
    "title": "瞬き",
    "series": "landscape",
    "tags": [
      "备用"
    ]
  },
  {
    "file": "images/web_052.jpeg",
    "title": "黄昏",
    "series": "landscape",
    "tags": [
      "备用"
    ]
  },
  {
    "file": "images/web_053.jpeg",
    "title": "朝霧",
    "series": "landscape",
    "tags": [
      "备用"
    ]
  },
  {
    "file": "images/web_054.jpeg",
    "title": "夜明け",
    "series": "landscape",
    "tags": [
      "备用"
    ]
  },
  {
    "file": "images/web_055.jpeg",
    "title": "水面",
    "series": "landscape",
    "tags": [
      "备用"
    ]
  },
  {
    "file": "images/web_056.jpeg",
    "title": "坂道",
    "series": "landscape",
    "tags": [
      "备用"
    ]
  },
  {
    "file": "images/web_057.jpeg",
    "title": "路傍",
    "series": "landscape",
    "tags": [
      "备用"
    ]
  },
  {
    "file": "images/web_058.jpeg",
    "title": "灯台",
    "series": "landscape",
    "tags": [
      "备用"
    ]
  },
  {
    "file": "images/web_059.jpeg",
    "title": "霧中",
    "series": "landscape",
    "tags": [
      "备用"
    ]
  },
  {
    "file": "images/web_060.jpeg",
    "title": "帰路",
    "series": "landscape",
    "tags": [
      "备用"
    ]
  },
  {
    "file": "images/web_061.jpeg",
    "title": "波紋",
    "series": "landscape",
    "tags": [
      "备用"
    ]
  },
  {
    "file": "images/web_062.jpeg",
    "title": "雨音",
    "series": "landscape",
    "tags": [
      "备用"
    ]
  },
  {
    "file": "images/web_063.jpeg",
    "title": "木漏れ日",
    "series": "landscape",
    "tags": [
      "备用"
    ]
  },
  {
    "file": "images/web_064.jpeg",
    "title": "足跡",
    "series": "landscape",
    "tags": [
      "备用"
    ]
  },
  {
    "file": "images/web_065.jpeg",
    "title": "斜光",
    "series": "landscape",
    "tags": [
      "备用"
    ]
  },
  {
    "file": "images/web_066.jpeg",
    "title": "翳り",
    "series": "landscape",
    "tags": [
      "备用"
    ]
  },
  {
    "file": "images/web_067.jpeg",
    "title": "静寂",
    "series": "landscape",
    "tags": [
      "备用"
    ]
  },
  {
    "file": "images/web_068.jpeg",
    "title": "風紋",
    "series": "landscape",
    "tags": [
      "备用"
    ]
  },
  {
    "file": "images/web_069.jpeg",
    "title": "雪解け",
    "series": "landscape",
    "tags": [
      "备用"
    ]
  },
  {
    "file": "images/web_070.jpeg",
    "title": "星屑",
    "series": "landscape",
    "tags": [
      "备用"
    ]
  },
  {
    "file": "images/web_071.jpeg",
    "title": "銀河",
    "series": "landscape",
    "tags": [
      "备用"
    ]
  },
  {
    "file": "images/web_072.jpeg",
    "title": "水平線",
    "series": "landscape",
    "tags": [
      "备用"
    ]
  },
  {
    "file": "images/web_073.jpeg",
    "title": "蜃気楼",
    "series": "landscape",
    "tags": [
      "备用"
    ]
  },
  {
    "file": "images/web_074.jpeg",
    "title": "蛍火",
    "series": "landscape",
    "tags": [
      "备用"
    ]
  },
  {
    "file": "images/web_075.jpeg",
    "title": "潮風",
    "series": "landscape",
    "tags": [
      "备用"
    ]
  },
  {
    "file": "images/web_076.jpeg",
    "title": "光芒",
    "series": "landscape",
    "tags": [
      "备用"
    ]
  },
  {
    "file": "images/web_077.jpeg",
    "title": "追憶",
    "series": "landscape",
    "tags": [
      "备用"
    ]
  },
  {
    "file": "images/web_078.jpeg",
    "title": "終着",
    "series": "landscape",
    "tags": [
      "备用"
    ]
  },
  {
    "file": "images/web_079.jpeg",
    "title": "序章",
    "series": "landscape",
    "tags": [
      "备用"
    ]
  },
  {
    "file": "images/web_080.jpeg",
    "title": "無題",
    "series": "landscape",
    "tags": [
      "备用"
    ]
  },
  {
    "file": "images/web_081.jpeg",
    "title": "未完",
    "series": "landscape",
    "tags": [
      "备用"
    ]
  },
  {
    "file": "images/web_082.jpeg",
    "title": "途中",
    "series": "landscape",
    "tags": [
      "备用"
    ]
  },
  {